360G-blf-0031044693,Oldbury Town Libraries - Activities for all,"This group will use the funding to deliver a series of community engagement and recreational events, which will challenge issues surrounding social isolation, improving levels of cohesion.",GBP,,7550,,2017-01-18T00:00:00+00:00,,2017-02-20T00:00:00+00:00,2018-02-20T00:00:00+00:00,12,,,,360G-blf-org-Brandhall Local History Group / Friends of Brandhall Library-Other : Non charitable unincorporated organisation-20042012-E08000028,Brandhall Local History Group / Friends of Brandhall Library,,,,,E05001272,Old Warley,,E08000028,Sandwell,,,,360G-blf,The Big Lottery Fund,,AFE1,Awards for All,,,,,,,,,,,,,,,,,,,,,,,,,,,,,,,,,,,,https://www.tnlcommunityfund.org.uk/media/open-data/TNLCF_Grant_Data_2015-2017.xlsx,The National Lottery Community Fund,West Midlands,Sandwell District,E08000028,Old Warley Ward,E05001272,2019-07-03T12:23:06+00:00,http://www.nationalarchives.gov.uk/doc/open-government-licence/version/3/,
360G-blf-0031044684,WASP  Warley Activities for Special People,A community health project will be delivered with this funding. It will help improve levels of fitness for difficult to reach beneficiaries who are experiencing the effects of obesity.,GBP,,9910,,2017-01-18T00:00:00+00:00,,2017-02-20T00:00:00+00:00,2018-02-20T00:00:00+00:00,12,,,,360G-blf-org-Warley WASPS Triathlon-Other : Non charitable unincorporated organisation-24032016-E08000028,Warley WASPS Triathlon,,,,,E05001274,Princes End,,E08000028,Sandwell,,,,360G-blf,The Big Lottery Fund,,AFE1,Awards for All,,,,,,,,,,,,,,,,,,,,,,,,,,,,,,,,,,,,https://www.tnlcommunityfund.org.uk/media/open-data/TNLCF_Grant_Data_2015-2017.xlsx,The National Lottery Community Fund,West Midlands,Sandwell District,E08000028,Princes End Ward,E05001274,2019-07-03T12:23:06+00:00,http://www.nationalarchives.gov.uk/doc/open-government-licence/version/3/,
360G-blf-0031044288,Tividale FC Community Project,"This is a project to improve the group's infrastructure and community profile, enabling them to better meet the needs of local residents and voluntary organisations. This will build capacity for its service delivery.",GBP,,10000,,2017-01-04T00:00:00+00:00,,2017-01-23T00:00:00+00:00,2018-01-23T00:00:00+00:00,12,,,,360G-blf-org-Tividale Football and Social Club-Other : Non charitable unincorporated organisation-01011954-E08000028,Tividale Football and Social Club,,,,,E05001280,Tividale,,E08000028,Sandwell,,,,360G-blf,The Big Lottery Fund,,AFE1,Awards for All,,,,,,,,,,,,,,,,,,,,,,,,,,,,,,,,,,,,https://www.tnlcommunityfund.org.uk/media/open-data/TNLCF_Grant_Data_2015-2017.xlsx,The National Lottery Community Fund,West Midlands,Sandwell District,E08000028,Tividale Ward,E05001280,2019-07-03T12:23:06+00:00,http://www.nationalarchives.gov.uk/doc/open-government-licence/version/3/,
360G-blf-0031044312,My Time Active Weight Management Group at SDCA,"The funding will be used by this group to deliver a programme of health support activities, which will focus on the needs of people with hearing impairments. This will include cookery demonstrations and will encourage those taking part to adopt healthier lifestyles.",GBP,,2709,,2017-01-04T00:00:00+00:00,,2017-02-20T00:00:00+00:00,2018-02-20T00:00:00+00:00,12,,,,GB-CHC-1124084,Sandwell Deaf Community Association,1124084,,,,E05001283,West Bromwich Central,,E08000028,Sandwell,,,,360G-blf,The Big Lottery Fund,,AFE1,Awards for All,,,,,,,,,,,,,,,,,,,,,,,,,,,,,,,,,,,,https://www.tnlcommunityfund.org.uk/media/open-data/TNLCF_Grant_Data_2015-2017.xlsx,The National Lottery Community Fund,West Midlands,Sandwell District,E08000028,West Bromwich Central Ward,E05001283,2019-07-03T12:23:06+00:00,http://www.nationalarchives.gov.uk/doc/open-government-licence/version/3/,
360G-ptc-gr30,Ideal for All Ltd,Grant to Ideal for All Ltd,GBP,215732,215732,215732,2016-12-31T00:00:00+00:00,,2016-12-31T00:00:00+00:00,2017-12-31T00:00:00+00:00,12,,,,GB-COH-03196518,Ideal for All Ltd,1070112,3196518,B66 1JE,,,,,,,,,,GB-CHC-1159982,Power to Change Trust,,,Community Business Fund (CBF),https://www.powertochange.org.uk/get-support/programmes/community-business-fund/,,GB,E01010087,LSOA,,,,,,,,,,,,,,,,,,,,,,,,,,,,,Yes,,https://www.powertochange.org.uk/wp-content/uploads/2017/07/Copy-of-360-Giving-Data-PTC-up-to-15th-May-2019-Final-003-1.xlsx,Power to Change,West Midlands,Sandwell District,E08000028,St. Pauls Ward,E05001276,2019-07-03T10:15:40+00:00,https://creativecommons.org/licenses/by/4.0/,
360G-ClothworkersFdn-200805496,Grant to Yemeni Community Association in Sandwell,Digital equipment and roof repairs,GBP,,8800,,2016-12-15T00:00:00+00:00,,,,,,,,GB-CHC-1109403,Yemeni Community Association in Sandwell,1109403,,B677LX,,,,,,,,,,GB-CHC-274100,The Clothworkers Foundation,,,Small Grants Programme,,West Midlands,,,,,,,,,,,,,,,,,,,,,,,,,,,,,,,,Yes,,https://www.clothworkersfoundation.org.uk/media/1137/clothworkers-foundation-2016-7.xlsx,The Clothworkers Foundation,West Midlands,Sandwell District,E08000028,St. Pauls Ward,E05001276,2019-07-03T10:18:12+00:00,https://creativecommons.org/licenses/by/4.0/,
360G-blf-0031043593,Support for victims of hate crime,"This is a project for people in Birmingham and Smethwick. The group will use the funding to provide counselling sessions and networking groups for Eastern Europeans affected by hate crime, culminating in an end of project event. This will enable people to access advice and support, leading to improved mental wellbeing.",GBP,,9960,,2016-12-14T00:00:00+00:00,,2017-01-24T00:00:00+00:00,2018-01-24T00:00:00+00:00,12,,,,GB-CHC-1147433,EMCONET,1147433,7078248,,,E05001276,St. Pauls,,E08000028,Sandwell,,,,360G-blf,The Big Lottery Fund,,AFE1,Awards for All,,,,,,,,,,,,,,,,,,,,,,,,,,,,,,,,,,,,https://www.tnlcommunityfund.org.uk/media/open-data/TNLCF_Grant_Data_2015-2017.xlsx,The National Lottery Community Fund,West Midlands,Sandwell District,E08000028,St. Pauls Ward,E05001276,2019-07-03T12:23:06+00:00,http://www.nationalarchives.gov.uk/doc/open-government-licence/version/3/,
360G-blf-0031043355,Mamma-Licious,"Social activity sessions will be provided to local families with this funding. The session will engage beneficiaries in physical workouts, improving health and fitness.",GBP,,9972,,2016-12-07T00:00:00+00:00,,2017-02-17T00:00:00+00:00,2018-02-17T00:00:00+00:00,12,,,,GB-CHC-1102431,Sandwell Leisure Trust,1102431,5011501,,,E05001264,Cradley Heath and Old Hill,,E08000028,Sandwell,,,,360G-blf,The Big Lottery Fund,,AFE1,Awards for All,,,,,,,,,,,,,,,,,,,,,,,,,,,,,,,,,,,,https://www.tnlcommunityfund.org.uk/media/open-data/TNLCF_Grant_Data_2015-2017.xlsx,The National Lottery Community Fund,West Midlands,Sandwell District,E08000028,Cradley Heath and Old Hill Ward,E05001264,2019-07-03T12:23:06+00:00,http://www.nationalarchives.gov.uk/doc/open-government-licence/version/3/,
360G-blf-0031043372,Skills to Aspire,"A programme of IT support activities will be delivered to older people, equipping them with new skills.",GBP,,9900,,2016-12-07T00:00:00+00:00,,2017-03-07T00:00:00+00:00,2018-03-07T00:00:00+00:00,12,,,,GB-CHC-1143230,Hill Top Community Development Association,1143230,,,,E05001282,Wednesbury South,,E08000028,Sandwell,,,,360G-blf,The Big Lottery Fund,,AFE1,Awards for All,,,,,,,,,,,,,,,,,,,,,,,,,,,,,,,,,,,,https://www.tnlcommunityfund.org.uk/media/open-data/TNLCF_Grant_Data_2015-2017.xlsx,The National Lottery Community Fund,West Midlands,Sandwell District,E08000028,Wednesbury South Ward,E05001282,2019-07-03T12:23:06+00:00,http://www.nationalarchives.gov.uk/doc/open-government-licence/version/3/,
360G-blf-0031043370,Pick Me Up,"The school will install a climbing frame. This will enable pupils to take part in active play, leading to improved physical health and wellbeing.",GBP,,8913,,2016-12-07T00:00:00+00:00,,2017-01-03T00:00:00+00:00,2018-01-03T00:00:00+00:00,12,,,,360G-blf-org-Joseph Turner Primary School-School : Community School-01091974-E08000028,Joseph Turner Primary School,,,,,E05001267,Great Bridge,,E08000028,Sandwell,,,,360G-blf,The Big Lottery Fund,,AFE1,Awards for All,,,,,,,,,,,,,,,,,,,,,,,,,,,,,,,,,,,,https://www.tnlcommunityfund.org.uk/media/open-data/TNLCF_Grant_Data_2015-2017.xlsx,The National Lottery Community Fund,West Midlands,Sandwell District,E08000028,Great Bridge Ward,E05001267,2019-07-03T12:23:06+00:00,http://www.nationalarchives.gov.uk/doc/open-government-licence/version/3/,
360G-blf-0031043083,Yew Tree by the Sea,This project is a community event based on a day out at the seaside. This will enable people to celebrate their area and combat negative feelings.,GBP,,3997,,2016-12-05T00:00:00+00:00,,2016-12-08T00:00:00+00:00,2017-12-08T00:00:00+00:00,12,,,,360G-blf-org-Friends of Yew Tree & Tame Bridge Estates-Other : Non charitable unincorporated organisation-01022014-E08000028,Friends of Yew Tree & Tame Bridge Estates,,,,,E05001266,Great Barr with Yew Tree,,E08000028,Sandwell,,,,360G-blf,The Big Lottery Fund,,CEL1,Celebrate,,,,,,,,,,,,,,,,,,,,,,,,,,,,,,,,,,,,https://www.tnlcommunityfund.org.uk/media/open-data/TNLCF_Grant_Data_2015-2017.xlsx,The National Lottery Community Fund,West Midlands,Sandwell District,E08000028,Great Barr with Yew Tree Ward,E05001266,2019-07-03T12:23:06+00:00,http://www.nationalarchives.gov.uk/doc/open-government-licence/version/3/,
360G-blf-0031043190,Greets Green Neighbourhood Garden Party,"This project is a neighbourhood family fun day. This will provide intergenerational entertainment and will enable people to celebrate and share the communities diverse cultures, history and traditions.",GBP,,4756,,2016-12-05T00:00:00+00:00,,2016-12-14T00:00:00+00:00,2017-12-14T00:00:00+00:00,12,,,,GB-CHC-1145333,CBO,1145333,7705011,,,E05001268,Greets Green and Lyng,,E08000028,Sandwell,,,,360G-blf,The Big Lottery Fund,,CEL1,Celebrate,,,,,,,,,,,,,,,,,,,,,,,,,,,,,,,,,,,,https://www.tnlcommunityfund.org.uk/media/open-data/TNLCF_Grant_Data_2015-2017.xlsx,The National Lottery Community Fund,West Midlands,Sandwell District,E08000028,Greets Green and Lyng Ward,E05001268,2019-07-03T12:23:06+00:00,http://www.nationalarchives.gov.uk/doc/open-government-licence/version/3/,
360G-blf-0031043179,Everyones a Winner,This project is a series of cultural celebration days. This will bring people together to celebrate different ethnicities within the community.,GBP,,10000,,2016-12-05T00:00:00+00:00,,2016-12-14T00:00:00+00:00,2017-12-14T00:00:00+00:00,12,,,,GB-CHC-1122405,St Albans Community Association,1122405,6354930,,,E05001276,St. Pauls,,E08000028,Sandwell,,,,360G-blf,The Big Lottery Fund,,CEL1,Celebrate,,,,,,,,,,,,,,,,,,,,,,,,,,,,,,,,,,,,https://www.tnlcommunityfund.org.uk/media/open-data/TNLCF_Grant_Data_2015-2017.xlsx,The National Lottery Community Fund,West Midlands,Sandwell District,E08000028,St. Pauls Ward,E05001276,2019-07-03T12:23:06+00:00,http://www.nationalarchives.gov.uk/doc/open-government-licence/version/3/,
360G-ptc-gr63,North Smethwick Community Development Trust,"Funding to increase the opportunities to reduce poverty and equality through community business, accelerating the growth of community business and demonstrating the conditions required for community business to florurish in a place",GBP,10000,10000,10000,2016-12-01T00:00:00+00:00,,2017-01-16T00:00:00+00:00,2017-04-01T00:00:00+00:00,2,,,,GB-COH-02736636,North Smethwick Community Development Trust,1035308,2736636,B66 1BA,,,,,,,,,,GB-CHC-1159982,Power to Change Trust,,,Places: Empowering Places (EP),https://www.powertochange.org.uk/get-support/programmes/empowering-places/,,GB,E01010046,LSOA,,,,,,,,,,,,,,,,,,,,,,,,,,,,,Yes,,https://www.powertochange.org.uk/wp-content/uploads/2017/07/Copy-of-360-Giving-Data-PTC-up-to-15th-May-2019-Final-003-1.xlsx,Power to Change,West Midlands,Sandwell District,E08000028,St. Pauls Ward,E05001276,2019-07-03T10:15:40+00:00,https://creativecommons.org/licenses/by/4.0/,
360G-CR-2117648,Nia Development Project,Nia Development Project,GBP,,31274,,2016-11-30T00:00:00+00:00,,2017-01-17T00:00:00+00:00,2019-03-07T00:00:00+00:00,25,,,,GB-COH-04004120,Sandwell African Caribbean Mental Health Foundation,1082017,4004120,,RGN/GOR,E12000005,West Midlands,LAD,E08000028,Sandwell,,,,GB-CHC-326568,Comic Relief,,,Improving health and wellbeing,,West Midlands,GB,E12000005,RGN/GOR,,,,,,,,,,,,,,,,,,,,,,,,,,,,,,,https://www.comicrelief.com/sites/default/files/downloads/360_Giving_UK_0.xlsx,Comic Relief,West Midlands,Sandwell District,E08000028,,,2019-07-03T10:12:38+00:00,https://creativecommons.org/licenses/by/4.0/,
360G-SE-2016005057LOTT,Nokwa Bais 2016,"Funding under Sport England's Small Grants funding programme for a Revenue project titled 'Nokwa Bais 2016'. This project is a Rowing project, with a focus on beneficiaries from a BAME background.",GBP,,3500,3500,2016-11-28T00:00:00+00:00,,2016-08-12T00:00:00+00:00,2016-08-28T00:00:00+00:00,1,,,,GB-COH-03796674,Community Connect Foundation,1043405,3796674,B66 2HR,,,,,,,,,,GB-COH-RC000766,Sport England,,SG,Small Grants,http://www.sportengland.org/funding,B16 0AA,GB,,,"Birmingham, Ladywood",,E14000564,WPC,Birmingham,,E08000025,LAD,,,E01009140,LSOA,,,,,,,,,,,,,,,,,Yes,,https://www.sportengland.org/media/12725/360giving-sport-england-data.xlsx,Sport England,West Midlands,Sandwell District,E08000028,St. Pauls Ward,E05001276,2019-07-03T10:16:05+00:00,http://www.nationalarchives.gov.uk/doc/open-government-licence/version/3/,
360G-blf-0031042692,The Pocket Garden,This project will create an outdoor garden area that will focus upon growing food for a community that is experiencing the effects of poor nutrition and social disadvantage. This will create a new community resource that will focus upon improving levels of health.,GBP,,9119,,2016-11-23T00:00:00+00:00,,2017-01-16T00:00:00+00:00,2018-01-16T00:00:00+00:00,12,,,,360G-blf-org-Barnford & Farm Road Allotment Association-Other : Non charitable unincorporated organisation-07121975-E08000028,Barnford & Farm Road Allotment Association,,,,,E05001270,Langley,,E08000028,Sandwell,,,,360G-blf,The Big Lottery Fund,,AFE1,Awards for All,,,,,,,,,,,,,,,,,,,,,,,,,,,,,,,,,,,,https://www.tnlcommunityfund.org.uk/media/open-data/TNLCF_Grant_Data_2015-2017.xlsx,The National Lottery Community Fund,West Midlands,Sandwell District,E08000028,Langley Ward,E05001270,2019-07-03T12:23:06+00:00,http://www.nationalarchives.gov.uk/doc/open-government-licence/version/3/,
360G-blf-0031042172,Ace Social Club,The project will use the funding to expand social activities for older people and ensure the future sustainability of the charity. This will contribute to improved social health amongst beneficiaries.  ,GBP,,4770,,2016-11-15T00:00:00+00:00,,2016-11-25T00:00:00+00:00,2017-11-25T00:00:00+00:00,12,,,,360G-blf-org-Ace Social Club-Other : Non charitable unincorporated organisation-01031930-E08000028,Ace Social Club,,,,,E05001266,Great Barr with Yew Tree,,E08000028,Sandwell,,,,360G-blf,The Big Lottery Fund,,AFE1,Awards for All,,,,,,,,,,,,,,,,,,,,,,,,,,,,,,,,,,,,https://www.tnlcommunityfund.org.uk/media/open-data/TNLCF_Grant_Data_2015-2017.xlsx,The National Lottery Community Fund,West Midlands,Sandwell District,E08000028,Great Barr with Yew Tree Ward,E05001266,2019-07-03T12:23:06+00:00,http://www.nationalarchives.gov.uk/doc/open-government-licence/version/3/,
360G-blf-0031042094,European Friends Festival,"The group will use the funding to raise cultural awareness of Eastern and Central European communities by hosting some consultation events that culminate in a celebration day at a local community centre. This will enable the organisation to break down cultural barriers and showcase art, music, storytelling and ethnic cuisines in an open access community day.  ",GBP,,9750,,2016-11-11T00:00:00+00:00,,2016-12-16T00:00:00+00:00,2017-12-16T00:00:00+00:00,12,,,,GB-CHC-1147433,EMCONET,1147433,7078248,,,E05001276,St. Pauls,,E08000028,Sandwell,,,,360G-blf,The Big Lottery Fund,,CEL1,Celebrate,,,,,,,,,,,,,,,,,,,,,,,,,,,,,,,,,,,,https://www.tnlcommunityfund.org.uk/media/open-data/TNLCF_Grant_Data_2015-2017.xlsx,The National Lottery Community Fund,West Midlands,Sandwell District,E08000028,St. Pauls Ward,E05001276,2019-07-03T12:23:06+00:00,http://www.nationalarchives.gov.uk/doc/open-government-licence/version/3/,
360G-blf-0031041891,The Talking Tents Project,This project will deliver confidential advocacy sessions on a 1 to 1 basis. This will improve the confidence and self-esteem of young people in the local area which will lead to better chances in life.,GBP,,9847,,2016-11-09T00:00:00+00:00,,2017-01-11T00:00:00+00:00,2018-01-11T00:00:00+00:00,12,,,,GB-CHC-1114961,Krunch UK,1114961,5364024,,,E05001278,Soho and Victoria,,E08000028,Sandwell,,,,360G-blf,The Big Lottery Fund,,AFE1,Awards for All,,,,,,,,,,,,,,,,,,,,,,,,,,,,,,,,,,,,https://www.tnlcommunityfund.org.uk/media/open-data/TNLCF_Grant_Data_2015-2017.xlsx,The National Lottery Community Fund,West Midlands,Sandwell District,E08000028,Soho and Victoria Ward,E05001278,2019-07-03T12:23:06+00:00,http://www.nationalarchives.gov.uk/doc/open-government-licence/version/3/,
360G-blf-0031041872,Lyng Lightning Bolts,This project is extracurricular physical activity sessions for children. This will increase participation in physical activities which will tackle health issues.,GBP,,10000,,2016-11-09T00:00:00+00:00,,2016-12-14T00:00:00+00:00,2017-12-14T00:00:00+00:00,12,,,,360G-blf-org-Lyng Primary School-School : Community School-01011962-E08000028,Lyng Primary School,,,,,E05001268,Greets Green and Lyng,,E08000028,Sandwell,,,,360G-blf,The Big Lottery Fund,,AFE1,Awards for All,,,,,,,,,,,,,,,,,,,,,,,,,,,,,,,,,,,,https://www.tnlcommunityfund.org.uk/media/open-data/TNLCF_Grant_Data_2015-2017.xlsx,The National Lottery Community Fund,West Midlands,Sandwell District,E08000028,Greets Green and Lyng Ward,E05001268,2019-07-03T12:23:06+00:00,http://www.nationalarchives.gov.uk/doc/open-government-licence/version/3/,
360G-blf-0031041885,St Mary on the hill - Services development & feasibility,This project is a feasibility study into the use of a building to explore options for its use by the wider community. This will provide a vision and strategy to improve a potentially valuable community asset.,GBP,,9650,,2016-11-09T00:00:00+00:00,,2016-12-19T00:00:00+00:00,2017-12-19T00:00:00+00:00,12,,,,GB-CHC-234216,St Mary - Wednesbury,234216,,,,E05001281,Wednesbury North,,E08000028,Sandwell,,,,360G-blf,The Big Lottery Fund,,AFE1,Awards for All,,,,,,,,,,,,,,,,,,,,,,,,,,,,,,,,,,,,https://www.tnlcommunityfund.org.uk/media/open-data/TNLCF_Grant_Data_2015-2017.xlsx,The National Lottery Community Fund,West Midlands,Sandwell District,E08000028,Wednesbury North Ward,E05001281,2019-07-03T12:23:06+00:00,http://www.nationalarchives.gov.uk/doc/open-government-licence/version/3/,
360G-BirminghamCC-1003281,Grant Funds For 2016/17,GRANT FUNDS FOR 2016/17; Neighbourhoods and communities; Community Chest,GBP,,250,,2016-11-07T00:00:00+00:00,,2016-11-07T00:00:00+00:00,2016-11-10T00:00:00+00:00,,,,,360G-BirminghamCC-shanti_womens_group,Shanti Womens Group,,,B66 4QX,,,,,,,,,,GB-LAE-BIR,Birmingham City Council,,,Community Chest,,,,,WD,,,,,,,,,,,,,,,,,,,,,,,,,,,,,,,https://data.birmingham.gov.uk/dataset/bb896f0b-10d7-403d-bad4-cc147349c380/resource/6ff023e2-947a-4eb9-bd67-0cdd2c7163dc/download/ssystemsgovernancetransparencygrants360-giving-bcc-data_2014-17-v2.xlsx,Birmingham City Council,West Midlands,Sandwell District,E08000028,Soho and Victoria Ward,E05001278,2019-07-03T10:11:44+00:00,http://www.nationalarchives.gov.uk/doc/open-government-licence/version/3/,
360G-BirminghamCC-1003280,Grant Funds For 2015/16,GRANT FUNDS FOR 2015/16; Neighbourhoods and communities; Community Chest,GBP,,250,,2016-11-07T00:00:00+00:00,,2016-11-07T00:00:00+00:00,2016-11-10T00:00:00+00:00,,,,,360G-BirminghamCC-shanti_womens_group,Shanti Womens Group,,,B66 4QX,,,,,,,,,,GB-LAE-BIR,Birmingham City Council,,,Community Chest,,,,,WD,,,,,,,,,,,,,,,,,,,,,,,,,,,,,,,https://data.birmingham.gov.uk/dataset/bb896f0b-10d7-403d-bad4-cc147349c380/resource/6ff023e2-947a-4eb9-bd67-0cdd2c7163dc/download/ssystemsgovernancetransparencygrants360-giving-bcc-data_2014-17-v2.xlsx,Birmingham City Council,West Midlands,Sandwell District,E08000028,Soho and Victoria Ward,E05001278,2019-07-03T10:11:44+00:00,http://www.nationalarchives.gov.uk/doc/open-government-licence/version/3/,
360G-blf-0031041811,EPIC approach to Domestic Abuse (Sandwell),"The aim of this new project is to tackle low to medium level domestic abuse before it escalates using the EPIC (Education, Prevention Intervention in the Community) approach. The project will particularly target families with young children, or where the woman is pregnant, as this is the period where domestic abuse most often starts. The service will enable couples to stay together safely or to separate amicably and ensure that trauma experienced by children who witness domestic abuse is addressed.",GBP,,213007,,2016-11-02T00:00:00+00:00,,2017-05-01T00:00:00+00:00,2020-05-01T00:00:00+00:00,36,,,,GB-CHC-264713,Family Action,264713,1068186,,,E05001281,Wednesbury North,,E08000028,Sandwell,,,,360G-blf,The Big Lottery Fund,,RC5,Reaching Communities,,,,,,,,,,,,,,,,,,,,,,,,,,,,,,,,,,,,https://www.tnlcommunityfund.org.uk/media/open-data/TNLCF_Grant_Data_2015-2017.xlsx,The National Lottery Community Fund,West Midlands,Sandwell District,E08000028,Wednesbury North Ward,E05001281,2019-07-03T12:23:06+00:00,http://www.nationalarchives.gov.uk/doc/open-government-licence/version/3/,
360G-blf-0031041769,The Hall for All Project,This project will refurbish a community hall. This will enable the organisation to make wider use of the venue for community activities and events.,GBP,,9445,,2016-11-02T00:00:00+00:00,,2017-01-24T00:00:00+00:00,2018-01-24T00:00:00+00:00,12,,,,360G-blf-org-Sandwell Christian Centre-Other : Church-based faith organisation-01011953-E08000028,Sandwell Christian Centre,,,,,E05001262,Bristnall,,E08000028,Sandwell,,,,360G-blf,The Big Lottery Fund,,AFE1,Awards for All,,,,,,,,,,,,,,,,,,,,,,,,,,,,,,,,,,,,https://www.tnlcommunityfund.org.uk/media/open-data/TNLCF_Grant_Data_2015-2017.xlsx,The National Lottery Community Fund,West Midlands,Sandwell District,E08000028,Bristnall Ward,E05001262,2019-07-03T12:23:06+00:00,http://www.nationalarchives.gov.uk/doc/open-government-licence/version/3/,
360G-blf-0031041785,Activities 2017,The project will use the funding to provide support services and activities to adults with learning difficulties. This will provide the beneficiaries with the opportunity to extend their social circle and reduce isolation.  ,GBP,,10000,,2016-11-02T00:00:00+00:00,,2016-11-23T00:00:00+00:00,2017-11-23T00:00:00+00:00,12,,,,GB-CHC-1118130,The Warley Gateway Club,1118130,,,,E05001276,St. Pauls,,E08000028,Sandwell,,,,360G-blf,The Big Lottery Fund,,AFE1,Awards for All,,,,,,,,,,,,,,,,,,,,,,,,,,,,,,,,,,,,https://www.tnlcommunityfund.org.uk/media/open-data/TNLCF_Grant_Data_2015-2017.xlsx,The National Lottery Community Fund,West Midlands,Sandwell District,E08000028,St. Pauls Ward,E05001276,2019-07-03T12:23:06+00:00,http://www.nationalarchives.gov.uk/doc/open-government-licence/version/3/,
360G-blf-0031041779,â€˜Getting the benefits we needâ€™ research project,This project will conduct research which will enable the group to offer training and advocacy sessions for people who are living with disabilities. This will improve the standard of living and life chances of those involved.,GBP,,8225,,2016-11-02T00:00:00+00:00,,2016-12-13T00:00:00+00:00,2017-12-13T00:00:00+00:00,12,,,,GB-COH-6916509,Building Bridges Training,,6916509,,,E05001273,Oldbury,,E08000028,Sandwell,,,,360G-blf,The Big Lottery Fund,,AFE1,Awards for All,,,,,,,,,,,,,,,,,,,,,,,,,,,,,,,,,,,,https://www.tnlcommunityfund.org.uk/media/open-data/TNLCF_Grant_Data_2015-2017.xlsx,The National Lottery Community Fund,West Midlands,Sandwell District,E08000028,Oldbury Ward,E05001273,2019-07-03T12:23:06+00:00,http://www.nationalarchives.gov.uk/doc/open-government-licence/version/3/,
360G-blf-0031040959,A Community Event To Bring Music To The Park,This project will host a family event in their local park to bring members of a diverse community together. The event will centre around music performed on a new bandstand and will also include other activities and childrenâ€™s entertainment.  ,GBP,,2080,,2016-10-13T00:00:00+00:00,,2016-10-26T00:00:00+00:00,2017-10-26T00:00:00+00:00,12,,,,360G-blf-org-The Friends of Dartmouth Park-Other : Non charitable unincorporated organisation-22022012-E08000028,The Friends of Dartmouth Park,,,,,E05001283,West Bromwich Central,,E08000028,Sandwell,,,,360G-blf,The Big Lottery Fund,,CEL1,Celebrate,,,,,,,,,,,,,,,,,,,,,,,,,,,,,,,,,,,,https://www.tnlcommunityfund.org.uk/media/open-data/TNLCF_Grant_Data_2015-2017.xlsx,The National Lottery Community Fund,West Midlands,Sandwell District,E08000028,West Bromwich Central Ward,E05001283,2019-07-03T12:23:06+00:00,http://www.nationalarchives.gov.uk/doc/open-government-licence/version/3/,
360G-blf-0031040898,Moxley Community Afternoon Tea Party,This is project will hold an afternoon tea celebration event. It will bring together all different generations within the community.,GBP,,1950,,2016-10-13T00:00:00+00:00,,2016-10-17T00:00:00+00:00,2017-10-17T00:00:00+00:00,12,,,,360G-blf-org-Accord-Other : Non charitable unincorporated organisation-26051965-E08000028,Accord,,,,,E05001283,West Bromwich Central,,E08000028,Sandwell,,,,360G-blf,The Big Lottery Fund,,CEL1,Celebrate,,,,,,,,,,,,,,,,,,,,,,,,,,,,,,,,,,,,https://www.tnlcommunityfund.org.uk/media/open-data/TNLCF_Grant_Data_2015-2017.xlsx,The National Lottery Community Fund,West Midlands,Sandwell District,E08000028,West Bromwich Central Ward,E05001283,2019-07-03T12:23:06+00:00,http://www.nationalarchives.gov.uk/doc/open-government-licence/version/3/,
